"A little happy for the wine jeje ok it`sm my free time so who cares, jaja i love this day",positive
i`m staying up to watch it,neutral
I feel lazy watching other people work on my roof!  Kat Woman OUT,negative
Time to do house chores! Ugh!,negative
"has just finished reading Twilight and thought it was ****...okay, it was alright...okay, i love it and really wanna read the next one",positive
Jon made one of the greatest dinners ever: roast pork tenderloin on a bed of wild rice on a bed of mixed greens & yummy sauce. No wine,positive
baby alex i miss you  ily<3 good night</3,positive
 I will - but you will never know it`s me,neutral
 5 seasons that`s it? Sorry just noticed in ur previous update. My sis isn`t gonna be happy,negative
 aww poor Caity  :L add people n they will add you,neutral
 i`m not being mean,positive
" Reminders are good! Speaking of which, we haven`t had a Posture Check in awhile.....",positive
"Trying to got through my 3,000 + unread e-mail messages. Looks like this what I`ll be doing for the rest of the evening.",neutral
_J We`re in the same boat.,neutral
"_DAHSAR Thanxs hun, you too!",positive
" If y`all say so, I trust you on that one",neutral
 I created my account just to get a chance to chat with you (: I ADMIRE YOU! you`re amazing! you inspire me to write  <3,positive
finally got my SayNow account up and running  YAYY JBs got a Canadian SayNow number!.. is anyone else using their landline phone? CALL ME!,neutral
wondering what misery looks like? look at the faces of all the cubs fans at miller park tonite. sorry chicago friends. tonights our night,neutral
 Thanks for the support,positive
_uppercut that was such an `old man` thing to say,neutral
OMG - the M&Ms in my pantry are calling my name. I`ve been ignoring them all day. It is driving me completely insane. Too many calories,negative
who not here be glad!!!!!!! ur sso luckyyyyyyy i hate u r home n r not enduring dis!!!!,neutral
 YAY!!  I was supposed to be there next weekend. But its off now.   But I`ma make it out there...I <3 Philly.,positive
The girl in the hair salon asked me 'Shall I trim your eyebrows!' How old do I feel?,neutral
 NEW motorcycle and you POPPED a cable already? wow-you ride HARD!,positive
  you aint invite me,neutral
Is in starbucks,neutral
They gave me a regular coke instead of diet. Really??,neutral
Hate being skint  Anybody want to give me another job? haha!,neutral
 ok thanks  do you like my new pic? http://twitpic.com/4jewc,positive
"oy, im such a nerd..im writin 2 no1 cuz no1 is followin me  i mean lik sum1 was but their account was deleted due to 'strange activities'",negative
 and that prob wont happen....,neutral
 that and being so careless with her vocals.,negative
says HAPPY MOTHER`S DAY!  http://plurk.com/p/sv70e,positive
Done! Goin home to eat dindin and contemplate what the night holds for me,neutral
" Probably not a good idea, its hard to tweet on the web, I miss Tweetdeck!  *cry*",negative
lol my other tank/dps friend is having the same problem in a different guild.  wtf is wrong with this server?,negative
I AM SUCH A CREEPER  I feel disappointed because of it. **** my cyberstalking skills   the internet = no more privacy.,negative
 safer to say that your cube is now a sphere ... but roll with it buddy ... it is an awesome time ... esp the 1st one,positive
 I`ll be thinking about how many goals United are going to knock past City. How `bout you?,neutral
 #wheniwerealad can you explain how that worked? lol  and no rude  explanations pleeezzze,neutral
Twitter you suck,negative
 I don`t mind him not paying rent. I`m just over the moon at the idea of him moving out at least 12 years early,positive
My phone passed away yesterday.. He jumped off the table  Searching for a new phone...,negative
_Attack thanks dude!,positive
trying to fix some weird query,negative
" Um yeah ... role model for your peers you may not be.   But, I know you will be for your little one, so chin up.",neutral
1st day of master cleanse...wish me luck,neutral
Toris was SO fun! JB MOVIE WAS ABSOLUTELY AMAZING! and i had a good day at work!  YAY i loved the movie! :0,positive
Here`s a big moan for Dave Leyrock... IM UP IN 8HRS!  pity me! Coloursfest ahoy xo,negative
this is for   http://tinyurl.com/d8fgxr,neutral
Packing up and leaving inlaws house heading home sweet home... Had a nice weekend and back to work in a few hours,positive
"Back @ home AGAIN .. bathing kids, ironing clothes for hubby .. nephew`s graduation tonight! I remember when he was 2!",neutral
"is bored, cant go on habbo stupid ban",negative
 Enjoy the ride,positive
 yes I do! Because he is going to the marines to protect & serve and leaving me!,neutral
you can learn a lot from another person.. dont try to out better oneself when its all about love and happiness  goodnight,positive
Excellent the Suzaku 7 are back together  woop last episode  hope its a happy one i`m a sucker for these really lol shh,positive
 me toooooo! Thank u,positive
I am chillin w/ my homies,positive
Ben I Love yahh babe <333! i miss you hope to see u tomorrow  Mommy i love  you tomorrow happy mothers day! happy mother day to all moms!,positive
" Im not getting any treatments, we are just gonna hang out at the pool and the hot tubs.",negative
try to play John Travolta`s 'Grease Lightning' bassline.. it`s cool,positive
dang last url went down  ? http://blip.fm/~7aigm,negative
_xo  hey chick u alryt u at dads tmoro we sud do sumin aen like last week we neva dun oot this week lol  missed you ha bye hun ****,negative
" Amazing! The concert, the city, everything. It was really an awesome trip",positive
 The devil you say!  I`ve been waiting for the Black Widow in movies and now she won`t be awesome at all.,negative
 : Sir ! Everything Will Be Great InShaa`Allah,positive
" KH is the only thing I`ll be a weeaboo about.  I still prefer it in English but I`m impatient, haha",negative
   Wow what a beautiful picture... and by the way....I am straight....just wanted to let you know!!!     Bella,positive
 Namaskar & Namaste r both the same. Marathi people say Namaskar! its a marathi word.... should i ? ...naaaah !,neutral
 i wish you could come to Swindon...2 hours away...its my dream to meet you  xoxo,positive
"i want my WOOSOO like now plz  i gant wait, knowing she`s so close is driveing me NUTTS",neutral
Only have 80  followers... So sad.,negative
to cold for the beach  sucky.,neutral
today we say goodbye to the second good friend in a week from dmp  but at least the sun is shinning and I`m definately NOT working this pm,neutral
homework on a friday night...lame,negative
" http://twitpic.com/4v0vr - cool! you and your mother have awesome hair styles,! Wish her a happy mother`s day!",positive
 ohhh beautiful place. You on hols? Go steady on the mead!,positive
 My pleasure,neutral
_Reece naw missed it and the video cool looking sexy,positive
JONAS rocked tonight!  going to bed after I write a lil bit... Night and bless all,positive
my teeth and head hurts,negative
SUPER BUENO FTW!!! I am so proud of you guys.,positive
_ife not to forget cinnamon!,neutral
loves her mum very much! Happy Mothers Day to all the wonderful mothers out there,positive
" i hope to, no promises  they all my kids and the dog at the moment, a couple of flowers too",positive
 Sorry for your loss.  I know how you feel.  She or he was a lucky cat.,positive
is anyone out there??  so bored at work...,negative
 aww sorry boo. I haven`t bought a printer in 4 years; my canon i900d is still making amazing prints. Have zero fisheye exp.,neutral
" S`ok, trying to plot alternatives as we speak *sigh*",negative
Have decided I just can`t stand `s Alltop spam any longer.,negative
 next year will be sweeet,positive
Its too early,neutral
"Need to come up with another blog post today. But for now, I AM SLEEEEEPPYYYYYY!!!!!!!!",negative
 Part of an AR-15. Actually the only part of one that qualifies as a gun. You have to be 21 to buy them without parts on them.,neutral
 really enjoyed the podcast with  This was my 1st time listenening to the show. Will def listen from now on,positive
_carter  Ey boy!! I cant see the video because youtube says me :The vid is private. Why?  I want to see it. Besos grandes guapo!!,neutral
 last reply  a scholar in US Homeland Security said an ontology was created for it 'and everybody hated it[s prescription].',negative
No credit left on my mobile sorry Brit! *pounces back* Thanksss Tania for the EPIC photoshoot,neutral
http://twitpic.com/4wc1y - Cracking myself more & more up..  PhootoBoothingisFunForBunny Volumen Eins!,positive
 Good morning to you. Hope you have a nice productive day,positive
"listening to MCR, watching DVD`s, chocolate hehe  awesome",positive
I am tres depressed,negative
Hmph. This is nowhere near as effective as it was a few mins ago. I wonder if it was a coincidence. FOLLOWERS: please report ur findings,negative
 lol same here....wish there was a way to microsize everything...lol,neutral
bye bye for now you lovely tweeters and especially my followers,positive
"_Ichigo She tried to carry on aswell, bless, I suppose maybe that`s why kids shouldn`t be in it?",positive
This song is a slap on you face!!  ? http://blip.fm/~5jib6,negative
 Not sure it didn`t say it was 2 big. I jst saw the pics of u on ur last bday. You looked so pretty!! I miss you!!,neutral
 i was at the outlets too,neutral
Exams are so stressful,negative
 It is a sad commentary is it not?,negative
Facebook decided I`m annoying or abusive because I add lots of friends. At least I have no distractions from coursework now...,negative
I`m going to miss Miss Suhana,negative
 LoL! there u go..that`s the spirit haha,positive
 Philly hasn`t played it yet!!!  You have to do something about that!! Please,positive
 oh my... now im offended.  ha,negative
I am probably spamming my follower`s account.,negative
Major iPhone problems  Wont let me send texts BUT I can do everything else! Can anyone help,neutral
 hell yeah! Belgian beer is the bomb!!  :p,positive
 - I know! It was drizzling all the way to work!  Hope it warms up this weekend....,positive
It`s a really warm day in Seattle! My reeses chocolate is melting!!!,positive
" 'organization ...ITIL, forget about people (and so they fail)' preaching to the converted  IT is the people http://tr.im/kWUA",negative
The sun is wonderful but makes me feel incredibly fat.. The less clothes and more exposure thing  today I diet. Again......,neutral
"when i cheered,i yelled SHAKE THESE at the end of a chant and did the suck it 'X' and got suspended & had to give a public apology,lol",negative
I ? JONAS` second episode! Aww! Nick is so handsome,positive
At my rehearsal...gonna miss the game  please keep me updated! Go Nuggets!,negative
" Morning! If I get to see it, I`ll let you know. Right now, I`m going to go see Wolverine.",neutral
speakerphone with the bestie  love that kid http://tinyurl.com/qxyc2n,positive
_O haha .. i`m from philippines!  i just want to follow you!,positive
 i dont want you to go to india,neutral
OMJ! The 3rd episode of Jonas is too great! They are so funny. I wish I was the Pizza Girll. Lol <3,positive
 whats the next movie review going to be? You`re like wossy of brum. Just more controversial,neutral
 me neither,neutral
_Aitana K ??? What??? No way!!!! No,negative
 ha! I know..I`m very ashamed.,negative
I need to burp ....  Im so nauseas....,negative
" lol fine, I go for her too",neutral
Just uploading photos from the cell...nothin like true candid-ness!,negative
had a great time talkin with Mike tonight for three hrs.,positive
hoping i didn`t fail english. that would just be sad,positive
.  he`s in bed sick. Heavy fever. Went to dr`s. Part of the reason i`m watching Aladdin 2 now and still haven`t been fed,negative
wow...i have to many bookmarks...i just spent a good hour organizing,positive
" Wow, I`ve officially lost all faith in Britain, looks like our wishes weren`t met, sadly",negative
thanks for the props,positive
" I don`t think I am, my sisters refusn to get me a ticket now.  what you doing next week?",negative
Zach G. gets an extensive profile in this weekend`s NY Times Magazine. The chances of us falling in love are getting fewer and fewer.,negative
Today = marking *135,neutral
just finished  Emergency - by Neil Strauss - another great read Neil - congrats   miss you by the way!,neutral
Took a shift tomorrow.    I don`t really feel like working right now.,negative
Well its a good thing ``march`` wasnt very long and i didnt like it...cuz its deleted. Ugh,neutral
 well if i use all my tweets will be the push to make me go to the shop. and by the time im back it will be over hopefully,positive
" hahaha, I was busy, now I see what I replied to you! Yes that is true",positive
 Thanks `Mckenzie`,positive
my 21month daughter`s seperation anxiety is intense. it`s killing me. i cant leave her sight without her breaking into an anxiety attack,negative
"I`m pissed, someone took my wallet",negative
 I thought it was pretty good! I`m not a die hard Trekkie either.,positive
such.a.tease.,neutral
Woke up and there was sun! And then it started to rain,neutral
"Thanks for the concern, guys. A few stitches later, all is well. Whew.",positive
" I`m sorry, Andrew. I wish there was something I could do...",negative
" I`ve been unlocked for decades now...just not lucky, never have been.  Gottta make my own luck and that involves $$$$$",negative
" uhh, congrats for your two years anniversary",positive
blogging..it`s my new passion,positive
_a_michael Hey! thanks for another great day! I`m going to sleep now! I`ll chat with you tomorrow!  Sweet dreams!,positive
" haha no chance, I tweet rubbish back!",negative
DUSTBIN BABY ON AT 11.30 Cannot wait  x,positive
Went to sleep and there is a power cut in Noida  Power back up not working too,negative
" TAYLOR! are you back in Nashville now..or LA? well, how was your trip? did ya have fun? love ya girly!",positive
" this is twistory... in the making. Yeah, I stole that one from you",neutral
_Songs I know  Especially since the summer is such a boring TV time to begin with.,negative
 was being sarcy as usual,negative
 thanks Daxx you too!  God Bless you brother!,positive
EVERYBODY WELCOME !!!  Hello Nicole ;),positive
I knew I should`ve worn the SARS mask on the plane from SoCal.. feeling the beginnings of a sore throat,negative
lol exams i didn`t go to mcast or other school i finished form 5 and that`s it soo disappointed in myself,negative
 Awe - didn`t know cats got skin cancer,negative
 me too. I hate my computer so much..,negative
 no omelette today  dim sum tomorrow! FEAST!,neutral
" Totally unsurprised that Dave isn`t coming back to 10. But Annalisa is wrong for it, opposite of big warm mellow Dave.",negative
Evaluating my people...Dont like this part of the job,negative
 NOOOOO I hate traffic,negative
This Twittername is hosted by TwitterFridge. Email us if you want us to open the Fridge  Check: www.twitterfridge.com,neutral
Gotta go now .. i`m going to Circus .. the real Circus not Britney`s Tour  sadly ..,negative
"Getting closer to logging in. My left hand is so swollen, I can`t wear my wedding ring. I keep forgetting and worrying that I lost it.",negative
Why am I limited to only being able to sync with 1 MS Exchange account on iPhone?  ... same goes for Outlook. Why... http://bit.ly/etB8H,neutral
 i know!!,neutral
hope schools gonna be good tomorrow,positive
 Yikes!  I hope she was okay.  I never her heard her say her tummy hurt.,neutral
Think I`ll go enjoy the sun`s rays again...I LOVE being off work,positive
sickkkkk.  GET ME OUT OF THIS HOUSE! need to get active. whats going down? Celina havin a party? hit me uhpp!,negative
" You`re welcome. I`m going to repost several times to get the message out, maybe help another dog",positive
Off to Woolsery this morning to (hopefully) see North Molton U16 clinch the North Devon League title. Lovely day for it,positive
working from home office today and catching up on everything except twitter,neutral
" I miss you too, Mojokins! I go there, but not long enough to comment  Will do more this weekend!",negative
_mcflyandjb its okay!!!  x,neutral
Got the sniffles   I SO don`t want to get sick - I don`t need this.,positive
 Sounds like fun  LoL. At least you still have some hair right?  how was the weekend?,positive
http://pic.gd/fad84c One Sunday night at Helsinki. We hadn`t drink anything... xD yeah RIGHT!,neutral
 awe  wit the snap of my fingers n a nod of my head ur rain is gone  lol...thxs hit up afterwards,neutral
 Depends on what they want for it....I`ve become poor again,negative
" I don`t know what that means, sorry",negative
My legs are killing me now.  but i know it`s a good pain all in all.,neutral
Laying in the bed boreddddd looking through old cookbooks for new recipes,negative
Back at the vet and it isn`t good,negative
OMG...the heater in my room has been on all day while i was at school & now it`s boiling,negative
" Yeah, plus I always totally overspend",negative
 I treat my hair so badly. It`s revenge for it turning grey prematurely,negative
"Marley won`t watch the French Open unless it`s in HD, which it`s not...   But my latest political ad is: http://tinyurl.com/lvsn76",neutral
I just realized that I can`t forward text msgs with my iPhone.,neutral
 Morning,neutral
 LOL freakinggg I worse a lookse shirt and shorts and sandals and it looks like its gonna rain outside  boo yahoo wearther,negative
: Well that is just completely lame. I`m sorry dude.,negative
"Gettin some fuel, too bad no one is reading this!",negative
i seriously neeed to study,positive
its my last friday of my high school years!,neutral
" hi cs, welcome to the twitterverse, if i can help with anything, just ask",positive
"Anyone have an extra Keane ticket? I promise to buy you a drink and take rad pics for your FB / Blog / Flickr., etc",neutral
" I can understand, pains been part of my life for a long time now  I hope you feel a bit better soon.",neutral
 Hey Mr Luketic! I don`t have your number to send by phone.  You can email me at heathfox.com if that would be ok.,neutral
_and_jay hi!  **** your job!,negative
Gonna miss my gurl while shes on her honeymoon,negative
studying out of spite. whatever.. Wonderful unforgettable weekend with DC,positive
11 days till county raly  i had 2 tak 3 from 14 it took me a while,neutral
Woohoo! Procrastinating doing any work by going out to lunch! Have to wait for my sister now though  dang it,neutral
actually loves nesquik cereal,positive
 Not Columbus but just wanted to say sorry to be missing Indiana show tomorrow. So sad  I will be in the woods with 8 GS.,negative
sore throat. Planning the TET outing to Marwell though...good times,neutral
 aaawww  no worries fresh start to work on growing it out again,positive
 yessir that is 100% right,positive
 I love Broughty Ferry,positive
Happy Mother`s Day to all the Mom`s,positive
just finishing studying for LSATs and watching VH1 Soul,neutral
Watching Scrubs season 2. Oh I`m gonna miss that show,negative
im bored.. RC is goin maintenance,negative
I hate it when I am in pain,negative
N now the end to another wise great nite! Excuse me while I dream a little dream,positive
"haven`t twittered in forever. yeah, just had my sixteenth birthday party tonight",neutral
... A kidney stone. Really?? Ugh  http://tinyurl.com/qsw9vq,negative
Thinking of what I should do in Vegas??? Any good ideas or places that are a most see!??,neutral
i really cant take this.,negative
http://twitpic.com/4wsue - yeah  well thanks *blushes*,positive
May the 4th be with you. Happy Star Wars Day!  http://ow.ly/52Aw,positive
" Cool, I used to live 5 houses to the left of that place  Always something going on :p",positive
dude I have 2 more hours  and I`m all done with my work,positive
i have such a hard time talking to new people -  I am pretty sure I didn`t make a good impression.....,negative
trent reznor - liddle beotch doesnt get his way. this could be the title,neutral
 do u ever answer ur fans on here?? i wish u would. i have a question i`ve been wanting to ask u for months,neutral
" Yeah it did, it explained everything",neutral
"_mcflyandjb in heaven, i`ll go everywhere",neutral
Relaxing with my daughter watching Friends,positive
Ugh i hate photobucket! an amazing place to edit pictures is: www.picnik.com  i use it alll the time.,negative
 i hate this weather! When u have lived here ure whole life u get used to it...may is always rainy  ,negative
Good Morning Twits!  Let`s makes today x100 better than the one before! Start runnin,positive
 hi my name is Chelsea and i respect your opinion when it comes to dwts. you were great on there too!,positive
i can`t stop listening to  new single! (paranoid) it`s so amazing. i love them.,positive
"wow my grandma passed away....I`m too sick to even think, I know she`s in a better place now",negative
 Is it culture day? Love it. I`m telling you graf culture in the study,positive
Listening to Hey Zulu - Red n` Meth. Sux to be at work right now,neutral
  dude i will check again but i couldnt find anything  haha i am capital ****-E-D,negative
__marie lol..french toast sticks too!,neutral
http://twitter.com/djc_yana ~ yeah. haha! why?,neutral
I want more followers.,neutral
" Have fun, hon! Ooh, look what a poet I am.",positive
i lost a follower,negative
Just found a tink cover for a wii remote but the people i know dont have a wii  fail,negative
That`s it? It`s done already? This is one proof that there`s nothing fair in this world.   http://bit.ly/10UEMq,negative
got my cable set up! WIN!  got my lock put on my door! WIN! feeling a tad neglected... FAIL.,neutral
" I had it! On my itunes, but then I lost all my songs.",neutral
Took me 2 times to get over the wall. What killed me was the 150 lb dummy that you can`t drag. 12  seconds over.,negative
 what? You won`t be two blocks away any more?,neutral
"hungry, but don`t have an appetite",negative
 This is true... Clean clothes is a VERY good thing!   Enjoy your day! Love your new avatar BTW!,positive
" Congrats!  I cuss like that in a matter of minutes, But didn`t know until now there is a reward for it.",neutral
 Oceans 12,neutral
people with mustaches get super powers and mustaches. no fair.,negative
  god you guys...i`ll call you guys...three way. to discuss.,neutral
http://bit.ly/Wl9yL  i want to go here,neutral
 never invite,negative
"So, what are you all doing? I`m eating crackers! Yummy. The unsalted ones of course. I only do salt in my caviar.",positive
" saw your pics, so awesome!",positive
First ever dropped call on my mobile. On a call to  no less! ( being charged for data even though I have a data pack  ),negative
" no prob, you have a sexy site there",neutral
I`ve Got An Urge To Make Music Like Massively.. I`m Going To The Studio,neutral
Good Morning,positive
"It`s a good day! The lake is a mirror, the kids are happy, and I get to clean the cabin today... Err two outta three ain`t bad!",positive
 me neither at first...but u gotta go thru somethin first to get there lmao...i almost burnt my house down and that set me str8,negative
" Just been in that kind of mood, not reason at all. Lol, but I`ll try not to be too mushy around you!  I can behave!",neutral
 romance zero is funny,positive
lousy **** landlord.   need to focus on kid`s packing but cant . nevermind sew sleeping bag,negative
 i want to experience snow  we don`t have snow here and it sucks,negative
So much to tell-Only blip is her immune system hasn`t recovered-not yet a newborns. Give it 6 more months.  But that`s nothing.,negative
Yukky  Rainy Friday,negative
Trying to recover photos after a problem between Windows and my XD card. Result: shots are all half visible  **** Microsoft...,negative
Reading Breaking Dawn,neutral
 another purse? Need to see photos.,neutral
"Ok, i`ve eaten some food and now bored to death in my room. Seriously, there is nothing to do. Guitar been taken to the venue!",negative
noooo!   all summer?! I won`t see your charming little face ALL summer?!,negative
 cuz ima always late haha dammit she got me good,neutral
 will the presentations be available online during the meeting?  The poster discussants are going so fast I can`t write fast enough,negative
so i got to my exam centre n they said we can`t let u becuz of your sleeveless top! U cud BELIEVE that!? i had to go home,negative
  a good girl nevah tells hahahahaha! hope you had a good weekend,positive
HAPPY MOTHERS DAY!,positive
" logically, yes. i just have to find one though. always seem to see them beside motorways when you cant stop",neutral
i dont wanna miss the laker game tonight! i`m so sad,negative
"time always seems to fly when im with wade, its weird; but i like it... a lot!",neutral
Howdyyy,neutral
'family bird is the word' I <3 FAMILY GUY,neutral
bye for now people .,neutral
well.. all my slacking off earned me a D and a C   but at least everything else are A`s and B`s ^^  next school year all B`s and A`s Esh!,positive
Fighting a migraine   Medication is almost working.,positive
Got an appt. w/ the doctor at 4pm today to look at these 'bites'. Hoping it isn`t an infection. I need more powerful anti-itch cream.,neutral
my momma is comin 2night !  2morrow tennis day with p?nar yuppie !,positive
just came back from a nice bike ride with her family and is now refreshed thanks to a shower,positive
Back from London  Now just catching up on all the tv and sleeping all day!,neutral
 Thank You Clayton. Going to my favorite Greek Resturant after church for mom`s Day!!!!  Loved you on Huckabee,positive
 Joe`s version is pretty but it`s a sleeper.  Shouldn`t be played at 1am.,neutral
"_by_spork haha I like it anyway, although i miss the spork in the pic... where did it go?",positive
 Not had an offer like that for a while,neutral
"Season 1 of Lie To Me was serious. ****, now here comes the wait.",neutral
