"Just opened a facebook account, I`m a little confused I don`t really get it. Twitter seems much better",positive
I must have just missed   & I guess I scared  & _TX off...  Sorry,negative
  that would mean me babe! but **** it my name  is SUPER FREAKIN COOL! I give myself a pass! HA!,positive
Is listening to the new jonas brothers song,neutral
my sister is a douchebag,negative
happy momies day  http://bit.ly/Skqli,positive
 - great site.  The photos on it are fantastic.  Will be very useful for my visit to Pembroke (inc Skomer) in June,positive
"If you followed us recently, PLEASE dont be offended that we haven`t followed back. We hit our limit.   Hopefully we will be free soon.",positive
had an awsome salad! I recommend getting the Spicey buffalo chicken salad!,positive
"Hope all the Mum`s out there had a Mother`s Day with love, close family & friends.",positive
Is with our dog at the doggy park!,neutral
" Sigh. It is a sad, lonely profession.",negative
"failed inspection. Did you know you can pass wo/oven, but not wo/anti-tip bracket, which is only sold w/oven? This is worse than taxes.",negative
" If I end up working in DC, GMU is on my 'short list' for Masters No. 2. Started Sys Eng program in the 90`s; never finished.",neutral
"Looking to sketch final catwalk outfit, i really REALLY want my long pink hair back. i also want to dye my models hair pink not allowed",positive
AHHHH! Cant find anything because I have way too much open,negative
decided that wolf in a future Star Trek Logo game would be much cooler than Chewy in Star Wars,positive
" ah its getting there  still a fair bit to go, but it`s coming together fairly well! aw  where are you from?",positive
as if i finsh work at eleven.. IS THAT EVEN ALLOWD?  cauz i really dont want to.. lol,negative
Bad day  The day you realize what mess you`ve put me through will be one of the happiest days of my life...,neutral
 Whom do yu wanna kill ??,negative
"Is going to attempt to cook chunky beef & mushroom pie tonight  mmm, i`m hungry already!",neutral
can`t stop smiling  i`m in the best mood right now!!!!!,positive
" Unfortunately, yes...not outside!",negative
"Taking back the HORRIBLE shoes my mum made me get.. urgggh. They are some nasty footwear! Problem is, I can`t find any other shoes!",negative
.: no health insurance is not an option.,neutral
 me and dee mack talking about your baby!  She`s almost all grown up!,positive
 SWEEEEET - San Fran is awesome!!!!  Love it there,positive
" Their inability to manage money, tough job market, and they`re getting behind on bills. This is why no savings is bad",negative
_zorz_peep count yourself lucky i was gonna say the OTHER word instead...and rsvp...sorry i cant come to ur birthday...day?,negative
sorry to tweet about BGT but poor wonderful crazy weird Greg  so not fair. the silly little girl is never going to cope. urgh. NOT FAIR.,negative
 ahh retweet everything i say!,neutral
"First fail, cant tweet from phone. Oh how I love my work phone",neutral
i was an extra. got ready for work for nothing. studying all night,neutral
Actual wiki entry 'The Million Dollar Homepage' made me just shake my head due to the fact that ... sometimes...somtimes things just work,negative
"_ Oh ok then, I`ve been there before for a wedding. It was heaps nice there. I`m a big fan of Qld",positive
_carter The video is `private I cant see it,neutral
 so i`m screwed,negative
TODAy SUCKs - kisskass19: you and katey broke up?! Yah Kate Broke up with me  Its been awful nd Vodkas... http://tumblr.com/xkx1wgl8r,negative
"Thanks to all the people who added me on Skype  If you want to add me, my name is same as my twitter name, and my YT name, and Blogtv, etc",positive
"When someone edit your designs is called plagiarism right??, but what can you do??, I`m tired, exhausted and dissapointed",negative
" Welcome to Glasgow Felix, sorry I cant be there tonight",negative
 http://twitpic.com/4jam0 - better lighting would have enhanced the photo... nice angle though...,positive
Happy Mother`s Day 2 all the fabulous moms out there. The world wouldn`t run without us. Keep up the good work! Enjoy ur day,positive
my nail broke  I haaaaaaaaate,negative
http://www.dothebouncy.com/smf - some shameless plugging for the best Rangers forum on earth,neutral
: to triste,negative
@_TWEE haha thanks to you that`s my new word for the week! ****,positive
Looking for a show to turn my brain into mush so it doesn`t hurt anymore  Any good FREE online ones you know of?,positive
" yeah, but Mr. Mom`s I would say, appreciate their wives much more than the avg dad   I have a new found respect for mothers now",positive
This weather is awful! I just want to curl up and read a book all day,negative
everything is going wrong in my ' happy day',negative
Went out to get groceries...prices are inflating  Gas went up another 10 cents to hit $2.49... #TCOT,negative
I`m bummed that I can`t wear my sweet Nike kicks to work.,negative
I went over the limit for actions per hour for twitter clients.  i hate that limit.,negative
"I want to see my friends  Mindless fun. No work, all play. All drunk, all walwal. All being mean to each other and sleeping in one bed",positive
 Just saw you on TV for the Best Job in the World. Good luck.,positive
"Its so sunny outside, and I have no one to go out and play with",neutral
Mother`s Day has been good for me,positive
Reese`s pieces ily,positive
haha i just watch a funny **** video on youtube  made my day,positive
" yeah she`s part lab, part spaniel.. all energy hehe but i love her to death",positive
 Did you know that there is a shortage of shells for crabs to use on the beach due to beach combers? It is very sad,negative
 and I have to wait till January. Life is not fair!,negative
 hahah  okay then thanks for this short explanation ;),positive
 I`m now a member of the street!!,neutral
"Had a great weekend with One, hanging with Nick & Brendon, church this morning! Can`t believe Loretta won the Mothers Day raffle again!",positive
  My Power was cut off  thats where i went,negative
"_raven oh, I`m skeptical too. I just think it`s the best thing he could have said under the circumstances",positive
i miss my puppies...,negative
'i hear its wonderful in california.',positive
 aww,neutral
.....headache,negative
will maybe have my cell phone soon ! Yeah !,positive
I wish I could play guitar..... my guitar I got a few christmas`s ago is collecting dust! I need to learn! haha,neutral
 LOL yea I know! I`m almost done with my semester this week  yay!!,neutral
  you may have to email the tech support ppl. that`s odd.,negative
Ew traffic,negative
 aww...you`re such a softy...I can only imagine you a mess of tears at your own wedding...you won`t even be able to talk,neutral
"Ach I`m back on t`internet, and  has to go drive her mate somewhere so is w`out internet",neutral
Miss Cauzinhoooo already,negative
is online shopping...fantastic,positive
didnt do my devos...  hopefully my day doesnt suck because of it.,positive
TGIF Resto here at home is dayuummm expensive!,negative
I`m way to hungry to even think. I can`t go to work on an empty stomach like this,neutral
 perhaps because it`s 3 am Minday morning,neutral
" lol! I thought we was suppose to guess..****, I tried tho..lolol!",neutral
"actually, i like almost everything about my job right now. except the part where it`s not permanent",neutral
 OK! Oops sorry,negative
"Version 2 of our live, interactive Trans-Siberian ticket planner is launched: http://tinyurl.com/c5ljwm - its very cool",positive
 is there something wrong with the internet in chelmsford? my tv on demad isnt working right and my internet is SUPER slow,negative
" did you see the 15 sec clip of the New Moon trailer?? its up on ETonline.com ...check it out. its a big tease, though",negative
Already back from shopping and about to do a nice monday roast,positive
 hot weather for the lose. And I have to clean too!  Cleaning in the heat sucks balls.,negative
"I waited, listening to wind blowing through the tumbleweed? Are none of you old enough to know what to do when someone says 'Crackerack'?",neutral
" lol ik they are, but i figure i`ve kept it for a year+ without needing virus software or to get it fixed  sigh",neutral
oh and i forgot my cell at home  thankgod for this crackberry,neutral
what am i gonna do when my iphone is full!,neutral
today was the last day of high school for me and i ended up going home sick! ... stupid dead rats,negative
 did you run into someone I know this weekend?,neutral
 ok then,neutral
. I want all the soldiers to come home so we don`t have to hear about anymore being killed.,positive
" well sadly I live in the most boring city in the USA, so there is nothing to do here.",negative
 http://twitpic.com/624qo - but a brown snake bit my duck named Elvis  anyway ahaha Elvis is soo cutee!! And so is Nicho ...,positive
 I am lost. Please help me find a good home.,negative
"_Kaufer You cant argue w/them, as they actually have zero things to complain about so they make stuff up",positive
 aw honey... you just relaxin? That`s probably for the best.,positive
eh...but I`ll be picking cotton soon....need to suppliment my income,neutral
Getting very frustrated by people who don`t know what they want... can`t wait to go home tonight...,negative
And the Sun is shinning.........at last,positive
 O dear! HE`S HERE! OMGOGMGO.. U didn`t see that I was going to **** u..?,neutral
okie gonna tweet more because i am loosing you guys or girls,negative
talking on the phone with someone I`ve missed a lottt.,negative
" After many attempts, I can`t figure out how put a pic in the avatar. Tells me pic is too big. Frustrated trying.......sorry",negative
 You too sweetie,positive
New picture isn`t working,negative
 haha who thought that?,neutral
_Reviews THANKS!,positive
I think i should go to sleep considering i hav to b up on 3hrs....,neutral
 Yeah it is. Thanks,positive
watching Jon & Kate plus 8..can`t believe they`re divorcing,negative
Seems really quiet tonight...am jealous of those who are clearly having a more exciting life than me   Off to bed I think...,neutral
my deep fry drumsticks were not as good as i thought they would be,negative
i waited too long to buy pink tickets!  now we`re going to be in nose bleed!!  how sad  we`re taking binoculars...,negative
_rockett i know! And he laughed at the stupid `women`s right`s` joke. Wth! Glad we have the same humor!,positive
Still Doing Grench paper and still getting distracted,negative
Away to the cinema tweet later may the 4th be with you all  x,neutral
i cba with it now   ohwell might play another innabit,neutral
 Hey I saw SNL 2nite&I loved it!! especially the crumpin` ****-**** scene  'crumpin`34 dub' wow hilarious,positive
Sitting in an empty yearbook room.  attempting to figure this asap out lol,positive
 It will give me lulz from time to time.,neutral
 ouuhh dont cry  i feel so sad right now,negative
... and its FFA *evil grin* but Im so busy at work today I wont get anything done,negative
ohh **** i just realized she still not talking to me  it b like dat some times..,negative
"oh, not just his IMs, but also from all my friends who IM me! This really sucks, I am always not around!",negative
 I`m just sick of stupid guys but for a moment u make me believe not all of them suck then I get back to reality,negative
is feeling really sick,negative
"my girlfriend still likes sesame st, and so do I",positive
 haha better drunken tweeting you mean?,positive
Ugh id better get up for work,neutral
 ohhh i wanna go  gahhh but i dunnooooooo :S me confuzzzledd should i or not???,neutral
F1 & Star Trek...what a great Sunday,positive
 I miss you!!!! It`s lonely and empty without you!  http://yfrog.com/3o3zxoj,negative
 you have no interview today?,neutral
 my internet just crashed  i will ttytomorrow.,negative
  you and I apparently  how are you?,neutral
"The birds are out,, oh man... That`s NOT cool && I didn`t sleep yet for the night!!!",negative
Why can`t I sleep ????? Is it too much to ask for :-P,neutral
My sister just called... she`s officially in labor! Looks like Anna and Josie are getting a new cousin today!!  (And this one is a girl!),positive
Lebron maybe the MVP this year ... but I like the Lakers to win the NBA Title,positive
"Stupid liars. Glad they are ignorant, because I had a blast!!",negative
" can`t wait for it. i love your scripts. honestly, you should have a future career as a script writer  - Stock Twits",positive
 my sleep pattern is screwed i need to try and stay up 2 midnight so i can get some decent sleep coz i havent slept,positive
 hope y`all enjoy the MusicBoat Cruise.  What a tough job - haha!!!,neutral
Achieving a new appreciation on how a xml build script can really be painful and cumbersome,neutral
 and  thanks  hoping its just allergies and not a nasty flu!,positive
"I did the dishes and I`m now on a train to Newcastle. Have to leave #nontweetinggirlfriend behind for 2 weeks, which is always a bit sad",negative
Getting to play golf with our kickin` Leadership Team...I have a feeling they r gonna kick me on the golf course,negative
Don`t 4 get to call your moms tomorrow...mothers day,neutral
Ok just woke up and need to get ready before a day of getting twitterena 2.1 submitted!,neutral
 Well thank you! I`ll try and remember to put it somewhere,positive
 awesome! What a blessing,positive
 don`t know  and no not at all,negative
http://tinyurl.com/d53dmn     mcfly parody by chris moyles ****,neutral
_NJ Oh! I`m only in my 7   I just joined Twitter a few days ago....,neutral
 it was hours ago i came in.... and it`s only now i realised when i went to buy something online,neutral
"Google Adsense Income down by 6% in this months Payment, Indian Govt Happy for $ Falling, Publishers Sad",neutral
 That is annoying. What gear is it? I`ll take it off your hands,negative
 - NOT A HEAP HEY. JUST BOUT TU HIT THE SACK. ITS 1.15AM HERE. I NEED SOMEONE TU CUDDLE. SUCKS  WBU.? X,negative
Star trek was good times.,positive
" hahaha, as cartoon mascots go, the virl.com monster has some very nice details... a good shadow + realistic tonsils.",positive
The ship has landed.,neutral
 I never was good at platform games...,negative
"Happy Mother`s Day to all the mommies out there, be you woman or man as long as you`re `momma` to someone this is your day!",positive
 not funny he profiled my ****. Like wtf? I`m still kinda heated. Ugh,negative
 You`re not here. I hope you`re still resting.  I don`t want you to be stressed.,positive
is sad that she is not seeing Basshunter at Metroplex this weekend,negative
 I was gonna text u and ask what puff meant!!,neutral
 now cash u kno I`m not a hater.....jus upset I don`t have my update yet,negative
welcome  ! since it seems you`re interested in cheese I hardly suggest you to follow  too,positive
 hey Samantha welcome  and happy mother`s day!!,positive
new photo   im hungry...getting off the computer now!,neutral
" I empathise luvvie, I dont personally understand a grown mans need to dress in tartan in search for a little white ball",neutral
"follow me aswel !!!!!!!! if u have twitter, follow me lool !! www.twitter.com/djarka  koool",neutral
Working technology! I love you WAZ!,positive
" yes I am, do you want to meet?",neutral
 I miss u guys too  I prob won`t b bk til august sumtime... But if I come bk anytime b4 then ill 4 sure let u kno!,positive
<---My expression watching this again: http://tinyurl.com/eqbwe,neutral
_ray Bright Eyes=Contentment,positive
Chicago rocks my socks,positive
Missing Everyone,negative
thanks ,positive
 Well what im working on isn`t QUITE ready to post about publicly (still beta testing) but its a cool new script I coded,positive
_Thrifty eBay 10 mile rule not working for me.  Too many pairs of leather trousers being sold in Aberdeen. Will try next week.,neutral
 Can you talk to my hubby  and convince him that that`s a great present for ALL mommies???,positive
i just bit my tongue.  blood everywhere!!!,negative
 How is she spoilt? She`s like 10? 11? That was hard for her to be put up in front of 14m people.  She`s really young.,negative
working on diffusing that irritation but this traffic sure isn`t helping  mother F! it`s always real bad the days th@ i help plan stuff,negative
"Don`t know what to do right now...pretty bored, but I refuse to study. Any suggestions?",negative
 whooop! you got me on twitter!!  dang our line of communication keeps growing!,positive
 I did for years and then moved over to an IBM compatible.  Would love to have both on my desk!   Can you call me a techie?,positive
" if I do that, I`ll have no pc",neutral
 http://twitpic.com/2dmtn - I saw this pic and it reminded me of you in Anna and the King.. so cuuuute little fella,positive
OK tweeps.. sorry. too many twitpic. I`ll delete those pics as soon as  had `em copied,negative
_Crow Morning!,neutral
thanks so much for the discount code. looking forward to trying your pads out,positive
"wearing a pair of trousers that were loose last year, tight this year",negative
"Has work very, very soon. Way too soon!",neutral
"sooo tired, I wish I had time for a nap before work",negative
wishes he can just call her.  blah. it used to be so easy to move on. wtf happened?,negative
 that David -- nice to know he feels so comfortable 'twitting' or 'tweeting' us.   I have a feeling he misses home.,neutral
How is everyone on this fine Monday?   what is everyone`s opinion of the new Wolverine movie?,neutral
 bahah that would be really funny she would be really cut haha,positive
" i think it`s fun, you gotta hide, and defend from your enemy, fun huh?",positive
My mouth hurts. Wish I could cut my head off,negative
Looking forward to the new week with the presentation of my book in a store in Dillingen today and some interesting sales seminars,positive
"got in a fist fight with a old biker guy.......and how dare you even ask, yes i kicked his ****",negative
"now, 3 teardrops.",neutral
 haha nice to know I`m not alone! Working in the BBC and can`t see it,positive
it`s Blockbuster week in New Zealand - 'Wolverine' tomorrow followed by 'Star Trek' on Thursday!,positive
 then he has gone down in my estimation,neutral
"sigh, my sisters bein strange.. she came all the way from copenhagen to london, and now her phones turned off.. i wanna see her dammit",negative
 i`m watching CQC a brazilian humor program,neutral
" Si, no bueno  I guess I just don`t entertain him :/",negative
I`m so getting the cold,neutral
Can`t wait for  live! It`s ages away but still I should do a  and plan what I`m going to wear lol,positive
"Goodmorning twitter, oh my gosh, i woke up soooo nice, lol ... oh hai thar twitterverse. Happy #mothersday everybody  (especially mine)",positive
"Out with Bre, Jimmy, and Jon P?",neutral
I wanna go to the Borgata tonight if Rich is playing.,neutral
@ the San Antonio Missions game waitressing. Not a huge crowd.  Meaning a slow game.,neutral
" Bom dia! FRIOOOO... que delcia!!!! Good luck in your first day, Ju!",positive
 TY very much for FF,positive
"the free fillin` app on my ipod is fun, im addicted",positive
Doin` the Crocodile Rock,neutral
Officially out of my apt  Learned some stuff about the crazy neighbors that used to live across the hall....scary!,negative
at last i wr0te again....got bored the previous dayss....,negative
"just got in from michaels and had some shreddies  im well tired, it was fun though ryan wright stoned = LOL",neutral
 she is that`s why she never speaks to me in college i think  .....i might just stick to unzela...if hashim dosnt shoot me,negative
" What`s sad is that I actually had to google that term. That sucks, tho.",negative
"   I sent my donation to #Eric and wanted to put the banner on, but my avatar disappeared when I tried ~",neutral
 its so sad how dead it is.,negative
the dates of the hockey games were confused they`re next week,negative
just found out that my husband`s grandma fell down the stairs & is at the hospital with several broken bones...praying hard!,negative
I can Rome without Ceasar,neutral
 morning to you too joe,neutral
_Monk Neither are ELP!!,neutral
 wasnt it sad?  was the 3d good?,negative
wish it wasn`t raining,positive
is hungryyyyyyy!! going to eat traditional indian food...the pakistani way. woowoo!  hahaha! >[_()\/3,positive
"So anyone looking for a vinyl-clad playset with a 30 year mfr warranty? 3 slides, 4 swing slots, rock climbing wall, more! Amish built!",neutral
*pokes and runs away* ... I WANT SUGAR !,negative
pool is still closed  and it is cloudy. what should i cook tonight?,neutral
" ah it doesnt work for me  but i just want to say i love the beach girl, you guys are acee! england loves you (: ****",positive
_cath a couple of years  I knew you had one but I couldn`t find you for awhile..here you are!,neutral
  I`m @ work and missed everythin yesterday but don`t know wot? Anybody,negative
" LOL she is okay, its just he songs are so catchy they get stuck in my head",positive
" Speaking of which, we need to talk soon.",neutral
Im had to leave early to go to piccolo practice.,neutral
Uh-Oooh my throat is scratchy,negative
 yea so wassup,neutral
scary cape guy,negative
Little brothers being funny  Congrats on the engagement http://tinyurl.com/cv5nw8,positive
i need to get my computer fixed,neutral
sorry for taking over twitter with my i-can`t-sleepness,negative
 http://bit.ly/13f5m0  You are not alone in your disbelief but I am quite happy with evolution. It beats the alternatives posited,neutral
 My cats enjoy the sunbeams from the open windows.  I think that counts.,positive
" I`m 3 days late, but happy birthday  Hahahaha",positive
oh no. opera 10 is not google friendly  *weeps*,negative
it`s good to see all my family  was a good day today,positive
" I had a joke for you, but it`s too long to tweet.",neutral
" , finally, someone spreading the Hayley Love via Twitter. Welcome to the club, Taylor.",neutral
 if u can smell goodness all around you and energy of big city and pinch on butt feel real YES u are in Chicago,neutral
 Thanks for the song! Youre awesome.  I can sing along all day!,positive
" I think  has found it (http://bit.ly/3pj876 , but I can`t play it",neutral
 haha you have a better life than most. we should go get drinks again soon. jury duty has been boring,neutral
 Thanks for the shoutout,positive
Bonjour Twitterland !,positive
I am soo happy! Thank you baby for the best 1095 days of my life,positive
  and what did i do to u kk thanks,positive
 been there!  need somewhere NEW,neutral
 Looking forward to your gig in Ireland!!!  See ya there!,neutral
I should go shower but FFAF is **** distraaaaacting,negative
Gorgeous day! Off to Hash around Waterley Bottom - wonderful name for a village! Quiz Mistressing at the Porto this evening,positive
_Lia  Are the drugs working?,neutral
I am so full. No more food tonight... I don`t want no cake and ice cream at this party.,neutral
" trivia? Working, no computer!",neutral
Oooh the hangover,negative
" mmm thanks, if u get too stoned and eat it thats cool",positive
 thnx 4 the follow,positive
 I`m stuck with BOO!!!! Jeeeez shoot me now,negative
My graduation day... And i feel like a failure...,neutral
sittin at home watchin monster in-law waitin for pizza.. yum yum,positive
Want: To play Sacred 2... Reality: Spend all day at the hosp...,neutral
not so good mood..,negative
STOMACH ACHE!!! Ahhhhhh,negative
aww i feel bad cause i dunno if nicole is in the city looking for me. she`s probably worried  srry hun,negative
_henrie i would still rather be in your shoes instead in bed bc i work from 10-9 tommorow. i love cold weather.,positive
is Happy Mothers Day.   Taking Mum out for dinner to one of my favourite restaurants down Glenelg now,positive
   People are cruel sometimes.  I can`t imagine being a Star.,negative
third date went well....moving on to fourth!!!!!!,neutral
" Ha! Thanks Bryan! And don`t remind me about the state budget issues.  Actually, Steve only has 6 staffers in 3 offices.",positive
" I have no doubt, darlin`!  Just wish you could find a boy worthy is all!  You`re good people!",positive
 I`m so mad I cant go to that...you`re like an hour away from me.,negative
: Oh its begun long before this!,neutral
 lucky! I can`t see it tonight....,neutral
 hahahah of course  they have such a nasty display picture :`),negative
 yum. Do you do home delivery,positive
Found some great places but I might have to play it safer and wait 2 years till my car is paid off,neutral
 what fun are you speaking of?,neutral
Crazy debt issue. Maybe I had messed up when closing my old account? Not really sure but looks like I may have to cover it - aaargh...,negative
 sweet dreams,positive
 omgggg!! Hawaii!! That`s amazing!! I wanna live there,positive
" lol hi emmy, latin would help me study for the aptitude tests to get into grad school ;\ thats why i wanna take it",positive
has a terrible headache.  I need relief!,negative
UGH! I have GOT TO STOP biting my nails  grrrrr,negative
 the kid that got a second chance shudnt have. mowgli didnt. gutted,negative
" it is, and its shiny and if i could marry it i would.   ps. im good, you?",positive
"_B I don`t know but they aren`t worth it, only 6 people actually showed up lol",neutral
"Rope witdrawal in full effect, no one to tie, no teaching, no demos, no one to play with. But worst of all - No one to play with!",negative
Has no idea wtf Twitter is about but willing to give it a go!  Going out for a bit!,negative
: wait till the vacation ends! u shud be cycling a lot then!,neutral
I don`t think the coffee at work agreed with my tummy,negative
I think the sun and the moon are God`s way of reminding us that he`s always watching over us.,neutral
 Random has an a,neutral
_distel Maybe u have natural ability for languages  I envy u on that !!,negative
dam just finished watching Prison Break: the final break...omg i dont think i`ve cried so hard for a show..Finally understand the finale,positive
