"John, are you sure we aren`t mtb?",neutral
 nice capture,positive
 nope.. sliverlight is client a side tech,neutral
"I just put my TV on the Canucks game and they score  yaay come on VanCity baby (I know, I can`t believe I`m watching hockey either)",positive
"good time Rocking out @ open mic, thanks 4 all the love n support. Now working on Business plan presentation. No CG again 2nite",positive
Sitting with sabbeth in first period.  buhahaha we are so cool -sabbeth lmao,positive
 I always feel guilty about it,negative
  If I told you how often I wash my hair you would never speak to me again,neutral
i wanna go vivid light walk,neutral
" oh dear.  that is terrible. however, moleskine notebooks rule. a lot.",negative
"Broke Up with girlfriend, FEELING Very lonely and heartbroken  Sad times guys (N)",negative
thanks for the feedback everyone,positive
" Shoot, Rob I missed it. Just got home.",negative
 most of the time,neutral
Just lost my internet signal  how will life go on,negative
i`m celebrating my mother!!  and also celebrating my legacy as a woman of God.,positive
My whole immediate will be in the same city until some point tomorrow afternoon. This is monumental,positive
going thru bills,neutral
 Cant wait to do some of those things,positive
"Gorgeous day!  Worked the Master Gardener plant sale, trimmed smoke bushes, and now to do some writing.",positive
 ahhh...Lily`s new kitten just took a giant wet stinky **** on me,negative
 All is well..That ends well! < unless of course well times the power of three = the sum of ends if X being All,positive
" actually, I wish I was back in Tahoe.  I miss it there.",negative
" i`m hear ya dude, i can`t either",neutral
 that doesnt look good at all.,negative
" wow, honestly not surprising, every time they try to push that guy he gets injured",negative
4 hours of shopping over... good effort. Best part = chocolate shop.... YUJM!!!... yum even,positive
Jaydiohead 'No Karma' ? http://twt.fm/91610 #musicmonday This is not the android I was looking for. But it`ll do.,neutral
 Aye. Now I want cheesecake,neutral
is drinking. Yay!,positive
i have no idea what im doing and i am completely lost.,negative
_c re:headaches my wife is in the same situation and has finally decided to go with meds because its just too much,neutral
greeeeeeeeeeeat  this summer i have four classes...if you know me...u know why,positive
" My name is Chad, but I won`t be here tomorrow",neutral
Hmmm.... My whole body feels sore!,negative
 right..  making compromises is what kills us!,negative
wishes he had realized his wife hadn`t held onto the debit card before he took a long walk to get lunch and not after.  GRRR!,negative
Jumping im the shower after a long day of work  it shall feel ahmazing I CAN MATH!,positive
this goes out to the one n only smirker   cheers dave!  aka jak  aka the best chest ever! ? http://blip.fm/~5jjcc,positive
_Lay aww well I just randomly woke up and now I can`t sleep! Too many things on my mind,negative
 SHUT YOUR FACE! Why are you so mean to me? Pedro is supposed to be the mean one,negative
"it`s you and me forever ?, it`s you and me right now   flywithmeobsessive. Im crying",negative
 I am in the `real world` which apparently involves a lot less twitter....  sorry!,negative
I hate the dryer.,negative
 sorry change of plans for me   :`( revision for monday exam in a park with one of my friends,negative
Too warm!!!,neutral
i think iv hurt my tooth  and eilish and cassie are having a drawing competiton to draw cookies and pineapples haha :L .,neutral
 again your fault  i didnt make u leave,negative
First Day at the new job! Yeah!,positive
"`s plans didn`t go as followed, but its ok",neutral
 ooh ouch!   lovely weather but ****! cover up sugar! x,positive
 He says he feels mama tucking him in at night  He`s lonely but getting by. Tomorrow will be tough!,negative
I`m missing crab legs and attending my going away instead!,negative
 no panasonic charger.sorry,negative
Finally lost FM97,negative
 Home Friday makes me  too!!!,neutral
one of the estate agents next door just caught me singing along to wham,neutral
 thanks!!! it was a ballroom dancing competition,positive
I was feeling guilty about buying a luxurious pair of shoes yesterday until my house mate just saw them and got over excited,neutral
_michele but sometimes not having to say nice things all the time is kinda fun  *teehee*and now I`ll put this back on as well *halo*,neutral
 nice one !,positive
"OMG, it`s JULY`S LAST DAY!",neutral
"Sitting watching britain`s got f all talent, but have watched a small girl cry and it`s sad",negative
"Every time I pay off my library fine, I get a new one.  I`m a bad patron",negative
loves florida but misses her american friends,neutral
" You`re not the only one surprised that FreeTDS and UTF-8 don`t 'just work'. But you`ll get it right, eventually.",positive
" yay! now ill shall take your picture, and get a tattoo on my arm",neutral
Annoyed,negative
 blogtv was fun! can`t wait til next time,positive
 My iPod headphones have gone kaput.  Wanted to buy new ones. Should I buy some Bose instead then? Do they work with Apple?,negative
 Both of you,neutral
Got three shots today.   I can`t lift my arms...,neutral
" Yeah, yeah. Less #degenerate than current occupants of U.S. House of Reprehensibles. You can bet on that. Like MineThatBird.",neutral
"House season 5 - good stuff  time with GF, priceless.",positive
" Thx! Old computer here, too slow for both Kubuntu and Blender really.",negative
Link per my daughter  us.mobile.reuters.com/mobile/m/AnyArticle/p.rdt?URL=http://www.reuters.com/article/bigMoney/idUS1284981420090508,neutral
 haha. that`s awesome. good job,positive
work all day,neutral
Not going to the dance recital and now i feel like a piece of **** cuz it cost so much money,negative
"grr!  i hate being **** near forced to go places.  especially to sit on a bus for an entire day just to sit in a house in podunktown, va",negative
It was my baby bros last time singing in front of his school  im so so proud of him !!! but when did i get old  im only 22!,positive
" wow, that`s good",positive
I hate the dentist,negative
I think the UPS web site hates me now. Still no Brewing supply package.  Held hostage at work by slow UPS delivery,negative
A Banana and 2 cups of Coffee...Not a so Healthy Breakfast!,negative
 yes but they hate it when we do it...silly boys,negative
"Huge test at the parents` house. The food is so good, but stuck to one helping, no seconds. Feels good.",positive
 Scii-fi effects definitely look silly no doubt but its worth a watch inspite of that!!,neutral
happy mother`s day!!!     gr8 day,positive
 lol. I see what you did there.,positive
"@_iDANCE19 well yes lol ..  i had a chat with them earlier , there just not willing to learn anything else",neutral
I`m on my way to see `17 Again`.  I`ve wanted to see it for a looong time,neutral
"checked out Green Day on demand & saw the new live videos. U were right, they did blow my mind  I love u SGB, even more all the time, Mom",positive
 Because of the new #Kirk. That`s why. Because of the new #Kirk.,neutral
" yeah I was thinking about that ,ahaha",positive
  I have no idea whether or not to drink anymore...,neutral
" who`s the one always working now?  oh yeah, still me.",neutral
says Happy Mother`s Day to all Moms out there  http://plurk.com/p/stkr2,positive
"Cleaning out my desk, I`ve found a betting slip from three months ago, I stuck a tenner on #newcastle getting relegated. In the money",neutral
Just a reminder to Hydra clients to check your email for important account updates!,neutral
It`s  last Friday today,neutral
recorded some of a new song today! u wont hear it for a long time thooo... we might play it at shows tho! so comeeeeee,neutral
has broken off the fb wedding so sadly no longer has an excuse to get @ hauntingxealot to Goulburn,negative
" yeah, right. What if our politicians start using uploading their pics, lots of inside stories will be out",neutral
im thinking that im going to have fun tonight....and maybe some changes are coming,positive
Its rained ever day in Miami since I`ve been here.....,neutral
Feel like death  evil headache and need to pack and drive to parents. Bum.,negative
 Do a tour in the Philippines sometime.  A lot of fans here would really love that!,positive
 maybe I missed my chance this time,negative
And it`s starting to get cold,neutral
  is easier this way in my phone... I will twittpic from my pc later on I did it this morning with p. Diddy pic,neutral
That`s how you go from series to season. The days of being an elite team are over in Dallas. EPL Derby Day tomorrow. Tell me what I miss.,neutral
" i got 2 much 2 do 2nite 2b bored. In bath still hav wash, dry, straight hair, get clothes ready etc",neutral
" *laughs* I`m glad that you have self confidence - it`s a wonderful trait to have  I`ll applaud extra loud for it, okay?",positive
I didn`t go to the gym today and I feel bad,negative
Oh man sold out  had to step away from my desk for 10 min!  you were right,neutral
" thats what doting husbands are for LOL!!  I hope that once my braces go on, I can eat normally again",positive
 I had mint ice-cream for dessert tonight. Love the stuff!,positive
"is back...been feeling ill and extremely busy all week. happy mother`s day, to all you mama`s out there",neutral
Yayz! Today`s is the day I call and see if I got that job! x3 I ish so happy... even though I slept horribly... So I`m kinda drained...,neutral
Exam 1 today. Going to get my license renewed  The birthday is getting closer!,neutral
" you work really hard so, sometimes you need a break, haha.  so, yeah...just let me know if you need help in anythin`.",positive
Is heading home from foot surgery and wishing she had a boyfriend to come over and cuddle with,positive
Somebody please save the polar bears!,positive
at panera for lunch  byyy myself  aww,negative
watching crimson tide and eating apple sauce.,neutral
just got home from school and from the wake of my friend`s father.  so tired..,negative
school and the guy i like was talking to the girl i cant stand at all!!  ppl are just sooo...ughhhh!!,negative
 I think you and Tamera should have your own show anyway...the CW or ABC fam is not appreciating you like they should.,negative
Sleepy Tabz is heading to bed.  Fun night! Listened through the next episode of Joss`d!,positive
 I`m thinking the 'Chevrolet Doom' would be fitting for GM,positive
   me too.  it depresses me thinking about it.,positive
_Atticus Thank you,positive
have an extra Justin Rutledge ticket for the Mod Club tonight,neutral
michelle is a hot mama with chichis grande,neutral
  Those dog pic had me  ROLF!  The one  with the snow stuck too it  has that 'if looks could kill look' way funny,positive
 eeeeeeeeeeeeee i jealous sia i didnt get to seee,negative
Tired even though i didn`t do much today. glad we got to catch the second half of the cavs game ,positive
watching spongebob,neutral
 i know i really wanna do some more stuff im out of school in the next week so ill have a few free days a week... ill hit u up,negative
"Finally, im back online! I miss my lappy. So many things to follow up. Starting with Ning... Haha.",negative
just got on twitter. no friends to add!  none of my friends are in twitter,neutral
just got up  Wheres the sun? =O,neutral
home from work today.....son is sick,negative
shift time  bbye biochem waaaaahhhhhh!! http://plurk.com/p/wxizo,neutral
OK - I`m out of here for now. Just popped in to say Hi and check on things. I`ll probably head to the guttah later on tonight,neutral
happy mother`s day to all moms and pseudo stepmoms,positive
"NOOOOO! serena and darrian don`t remember each other, and i`ve been waiting all day to see them confess their love",neutral
My modem has been offline for a week now... God bless the 3g network. Tim just left... Again!! May schedule has been brutal,negative
"Possible case of H1N1 at Ft. Knox (KY) http://tiny.cc/gNYq7. Note: this is for info purposes only, so there`s still no need to panic",neutral
"CCs video for Long Gone premiers today on yahoo, dont miss it: http://new.music.yahoo.com/videos/premieres/ AWESOME video and version",positive
 giv ya mom n gman happy mothers day,positive
 when are u gonna host Saturday night live!! i`ve been waiting for like 2 yearsssssss!!,neutral
_Houdin blind faith. Thats a crack-up,negative
We`re practicing our blackjack skills. It doesn`t look hopeful.  http://yfrog.com/0l2tsj,negative
Cant sleeeeep & i miss my long hairrr,negative
Haha how exciting  wat does it look like?!,positive
I`m sick and sad .... missing out on Martini Lounge tonight,negative
_Lhoste Thanks you so much for following me on Twitter; I hope you find it as exciting as I do! Looking forward to your tweets!,positive
" Ooo showing of your French skills!! lol Things good over here. Lovely weather, so should be outside  How`s u?",positive
tonight was hilariouss  i loveeee everyone that was theree,positive
  i can`t.,neutral
"OK, home made pizza tonight, but horrors, I`ve run out of anchovies",negative
 OMG SO srry to hear that,negative
responding to more questions at Thou Shall Blog! I appreciate this community.,positive
 oh ok. Well good for you...can I get some weather updates instead??  jk.,positive
 so see you on my birthday visit me  haha why wack Saturday ?,positive
http://twitpic.com/67f8q - This is making me sad,negative
" Thanks for the tip! Unfortunately a major crash in my https site, just as ExtPlorer",neutral
http://twitpic.com/4wtom - This day is soo stressful! Geee.. Lunch was a blast tho! How are you guys??,neutral
" nope not going be able to finish it tonight, got a few other things to do before bed",neutral
"Good stuff, Smiles back? Why won`t you go to his concert too? :o. Wish I could instead of working on my music which is failing  lol x",positive
Thank you OpenDNS for saving me from Comcast`s crappy DNS server. My internet is back up to par finally.,neutral
this day has beasted me.,negative
 ugh I`m not doin too good,negative
Is Bored. Waiting Till 7:06 To Go Out To Tha Bus,negative
The sun is shining and I`m stuck in work,negative
 Is the Bee to Busy to talk to his buddy on Yahoo?,neutral
totally forgot she had soccer today. ugh  today was actually good too...,negative
: have fun focus grouping! i have no participants as of yet..,positive
 LoL Clever I`m Extremely Jealous Of The Amount Of Followers You Have  I Only Have 24,neutral
 thats pretty bad quality and probably the worst pic u posted till date,negative
epic fail with the chocolate fountain that got CLOGGED,negative
I`m super hungry! Waiting for my biotch to feed me.,neutral
**** being broke on the day Guitar Hero Metallica comes out!  Boooooooo,negative
 may the 4th be with you,positive
"I told andrew that JT is going to cameo @ MTV movie awards. He said, 'he`s pissing me off.' guess they`re in a fight",negative
im going to bed  nighttt nighttt xxo ily`s,neutral
SF felt WAY too intense for me tonight. Hope that doesn`t keep up. Upset with myself for not hanging with  and pearl,negative
had 2 leave the mrs  cuz i have to go 2 work  really didn`t want to.,negative
"Oh and thank alllll of you who put me in ur Follow Friday!!  to all of my new followers I usually do it, but today...I`m just too tired!",negative
im the only ho that didnt go to tigerheat tonite,neutral
" Looks like you did the full Lincoln Marathon yesterday? That is awesome, the HM was tough for me",neutral
 Thanks G! My actual birthday is on Tuesday and I will be 24.,positive
_lipz I don`t know  I haven`t heard from Lorraine recently.,neutral
 no its the same,neutral
 i cant get through,negative
watching 'Look for a Star' with mom again  lub ah C hehe,neutral
 yeah.. gives me something useless to crib abt,negative
im determined to slarm around my house and eat egg sandwiches. and smoke a few bowls. sounds like a splendid evening to me,positive
tomorrow valeria`s lunch!!! going to get my hair done but im arraving late   got my cousins babtizm or whatever you spell it,neutral
" It saddens me, you`re youtube has changed. It`s just like every other youtube kid, you used to be different",negative
working my way through this casualties discography.  have to pull weeds later  ...,neutral
Following _aisa These guys could be shifty but worth following regardless.,positive
"eating nothing, drinking water, about to watch a movie, join me?",neutral
_E  It`s an honour being your friend!!!! http://bit.ly/LhgZ2,positive
Going to jog down to uni. Quite a way from my family home but exercise and all that,neutral
"I just want this whole day to hurry up,",neutral
FTSK and Mercy Mercedes were amazing tonight.. as always,positive
sitting around doing **** all....tired,negative
"missing my hobo/****/tramp way of life, and cooking for my mother on a saturday night  MAMA I LUV U",negative
Watching aliens with my boobie at craig rise house 11 early bedtime for the grown ups,neutral
missing mrs mcfox,negative
 Oh no!! I hope it`s not bad,positive
. Okay kool... I might be touring all summer long but we can make it happen!,neutral
 I don`t have the app that does it,neutral
had a great time at six flags yesterday.. its summer   my friend spent the night last night and just left so now i`m bored..,neutral
 someone came in when I was sleeping off my national passtime and turned me human,positive
Havnt gotten any in months  my ex seems into dating but there isn`t that spark anymore  still in love with loser who left me,negative
 oh! so this could well be your last post!,neutral
"finally friday , but still grounded till next thursday    -- stereos = life <333",positive
Must be time of month: Watering eyes AGAIN!: http://tinyurl.com/cuwj2b (speciaal voor : zo vind ik ze wl leuk!  ),neutral
i have a whole day planned for my mom today that i know she will love!,positive
and this terrible cartoon that`s supposed to be mexican.,negative
just got home! not wanting to read the last chaper of breaking dawn cause i dont want it to be over,negative
" nm. dang, you on NOW but i gotta bounce in like 4 minutes  i`m just chilling. the usual.",positive
Lan Poker is so much fun!!!!  Someone help me remember ki compre chal raha hai abhi!!!!,positive
 We Agree!! You guy rock,positive
 I`ll be back home on Monday.,neutral
 Mine too! Hayley is great,positive
doesn`t sound so great at all  http://is.gd/JslB #palmpre,negative
is still sick  sigh,negative
"is back from the park and is very sunburnt  cant wait 4  2night,and is gonna get smashed..bein sober jst wnt b as fun!",negative
 It`s your inherent humility,positive
 Same! And big moths and wasps and just insects in general HAHA I hate them,negative
"Am in the place called 0UT OF NOW WHERE!! Take me out from here, somebody  http://myloc.me/1XRI",negative
"  you can have  ice cream, I`ll have  kiss.",neutral
tired as hell!!!! bed time from cara  nighty night twitter world..,negative
X-Men:Wolverine was hot! I say go watch it,positive
" Thank a Chu?t   Ch?c v?y qu, hik, ch?c em ph?i ?i h?c 1 kha ph? c?p ki?n th?c c? kh g?p =.=",positive
 Yes it does. Please dont` go. If you die I will cry.. which normally leads to small animals getting harmed,negative
Now I feel sick.,negative
is about to go buy his mother a mother`s day gift,neutral
just had a great talk with grace about how awesome God is and how he works...that somehow started with how remote controls work,positive
Bah a coworker ran into work late and her bag smacked into my knee  it really hurts now,negative
now my ds just died  whatta letdown!,negative
I am sad because I broke my super-awesome giant paper clip I was using for my Italy notes,negative
My Respect For Travis Clark Has Gone Down 7.5 Notches,negative
Sports car + curb = flat tire.,neutral
: more interested in watching SNL for Ciara than Justin Timberfake,positive
Rescued two adorable pit mix pups today.  LC and Brody.  Looking to adopt?  E-mail me for more info and pics!,positive
 http://twitpic.com/4fnaa - haha love you two girl,positive
Very succesful Cancertown Launch yesterday,positive
" thanks, I deserve it.",positive
Wishing I could kidnap  from work,neutral
I have to reupload the **** thing again,negative
I am currently doing a few posts on my business blog http://venturefile.com  check it out if you like it,neutral
ugh im crying again  writing a rant about it on tumblr.,negative
"_bmac I knooow, I want to sail",neutral
"  SAimee 26 july, Underage festival 2 August, i found some others but they were too far away",neutral
"Gotta drop off some car parts for a buddy to press out, then to the dentist!    http://yfrog.com/0a7v3j",neutral
 its the best show EVER!,positive
 sorry missed your post earlier about Edinburgh.  I am biased towards its awesomeness!  Glad you enjoyed your visit,neutral
 I would if I wasn`t working today.,neutral
"_ I`m good thanks! Did you have a good drive? Careful with your blackberry, we don`t want you getting screamed at",positive
 he`s not logging in yet.  and i doubt if he will check his his replies here in twitter. but we must keep on trying!,neutral
Got moommy somn special for mothers day,positive
 yeahh  idk if i like owen anymore though... i kinda lost respect for him in an episode i recorded...,negative
"_extacy lol i know eric, i wont delete you! just people i dont really know and never talk. and bands",neutral
 my friend sent u call bck messages. i dunno if you could reply but she has no credit thts all.,neutral
I read 'The Picture of Dorian Gray' by Oscar Wilde (on english). It`s not easy for me but I try to make out,neutral
happy mother`s day! everyone have a great day and make sure you go see ya mommas,positive
"Just got back in, and I`m absolutely exhausted, have to be up in 5 hours for work",negative
 sorry but I`m not impressed in the slightest b/c u don`t eat ****..more like saddened and confused,negative
 oh plzzzzz u never had time for me!!!,negative
 no bueno.  hollykins needs to feel better asap.  p.s. i miss you.  you done with uni soon aren`t you?  SOPROUDOFYOU.,neutral
 dont cry for me! i will see u tomorrow.  muah.,positive
Lazy day in is awesome but I really should go out,positive
Grabbing coffee from  then making mom breakfast,neutral
"humm.... I adore Mark #hoppusday ,so I`m just going to throw it out there #hoppusday....... have a nice #hoppusday people!!",positive
Getting really guilty,negative
" Yes, this NBA song is great!!!  Got an old funny NBA cheerleader remix song. Ohrwurm of the day 'colorblind'.",positive
Can`t sleep...so I`m watching HGTV. I`m afraid infomercials are about to take over,negative
I wish I could get my nails done  stupid job,negative
 that sucks!  how old are you actually?,negative
"just when i thought things couldn`t get any worse. it just did. and it will get even worse tonight, i bet.  my life is a misery.",negative
Morning tweeple,positive
 not really ;D nice pic .  no but could u imagine those 2? ... i thought so,positive
10-Year-Old Girl Battles Rare Breast Cancer  http://bit.ly/JPe9c,positive
i hope i can find a store to take us,neutral
weather starting to be better  So just SHINE **,neutral
Just woke up :o mums singing to her new gn`r cd replacement i bought because im a good daughter,positive
 hi.wanna see 17 again again with me ;) i`ll fly to cali and see it with you,neutral
starting to pack stuff up,neutral
apparently even Novell Moonlight doesn`t work on my Jaunty,negative
 thats what i was thinking but the only time it`s gonna be on is 1 am!,neutral
industrial tommorow! oh yeah & I get to go see a bunch of old people go away forever & I will probably cry all over the place.,negative
" that truely is sad news to hear  we are all created equal, so sad to know our neighbors are such prejudice people",negative
 that sucks!!,negative
has has an ok day with jo. She bit me and now its bruised.,negative
I like taking my dogs with me in the car when I run errands. They are always excited to go anywhere. like this morning to Krogers.,positive
 heard through the grapevine that we might see you around today. Looking forward to meeting you.,positive
 yummmm make sure u leave some 4 me im home cleaning up working mad hard,negative
melissa_leah: my car wont start.......,negative
 I`d just plain go crazy,negative
I`m sure all you people with hangovers will be glad to know I`m hangover free   hope you`re not too fragile this morning!,neutral
  i`ve seen inkheart- i liked it too,positive
 I`m soo jealous right now!!,negative
#fieldnotes I ordered some on the 8th and they still haven`t arrived. 3 weeks and still no books,negative
" MY FAV. SONG IS UH...honestly, its rude for u to make us choose.  lol I love `em all!",neutral
" good job I have the track in my head, cos sadly can`t access it, boo",neutral
Anyone want to buy me this anthropomorphic planter? http://tinyurl.com/m6sru3 Only available till the 31st,neutral
"Finally the school day ended, Friday Friday Friday w00t! But it`s raining outside.",neutral
 sure i willl ....,neutral
 Had parent teacher thing yesterday!! So boring going to skl on saturday!!  lol,negative
so sad that no friends everyday for a long **** time,negative
Shopped til i dropped....come bac sunshine i miss u,negative
" i know, right? i`m super-excited - i told y`all this is the busiest time of year for me",positive
 I can`t direct message you for my free lunch,negative
 - I will see if there`s a used organ shop there & let you know. But why not just sign up to ejamming.com and rock out!,neutral
Happy star wars day everyone,positive
had a **** contact with both parents >.>  grrr,negative
Hey Tweeps...good morning. Wussup America...Talk to me tell wut`s on ur mind..,positive
"_M ah. knowing microsoft, they could probby do it, but would want to charge way too much extra for it",negative
'I want you in my mouth and my **** b!tch' mm jeffree rawks,neutral
 oh no fair.... thats in 9 hours,negative
concert tonight  chackin out and not coming tomorrow!,neutral
